{
  "schema_version": 1,
  "verdict": "adjust",
  "confidence": "high",
  "findings": [
    "Q1 (Reducao real vs deslocamento de custo): a evidencia empirica citada pela propria T032 nao sustenta reducao liquida de contexto. Em evidence/T023-r01.md (Tabela do SS7.2), o Braco B (sessao nova + Pacote Curto) consumiu 436.372 tokens de entrada bruta e 442.519 tokens totais, contra 64.701/67.770 do Braco A (historico longo) -- um custo bruto cerca de 6,5x maior no unico caso medido. A economia so aparece como 81,8% de cache hit de prefixo (356.864 tokens cacheados) dentro do proprio Braco B, um efeito de infraestrutura do harness (prefix cache do provedor), nao um efeito de desenho do protocolo. O que o piloto demonstra de forma solida e ganho de governanca (zero violacoes X1-X4 no Braco B contra uma violacao X2 no Braco A), nao economia de contexto. O Principio 7 da propria proposta ja reconhece isso corretamente, mas o Escopo Tecnico da Fase A (docs/WORK_MODEL.md, EXECUTION_PROTOCOL.md, CONTEXT_POLICY.md, scripts) nao inclui nenhum Acceptance Criterion de instrumentacao continua obrigatoria de custo; sem isso, a reivindicacao de eficiencia pode virar folclore operacional pos-freeze mesmo com o Principio 7 escrito.",
    "Q2 (Conjunto minimo suficiente): o schema ja implementado em schemas/resume-manifest.schema.json (herdado de T022) exige active_work_ref, phase, spec_revision, sources[], resolved_context[], effective_authors[], open_items[], next_action e always_read[] -- um nucleo proximo do necessario para o metodo native. Porem esse schema tem additionalProperties:false e NAO contem state_revision nem content_id, apesar de a propria Estrutura do Pacote (item 1 da spec de T032) e docs/WORK_MODEL.md (secao 'Versao do trabalho', linhas 347-358) tratarem essas duas identificacoes como parte da identidade qualificada do trabalho. Sem state_revision no manifesto, uma sessao nova nao consegue distinguir mecanicamente 'spec inalterada desde a geracao do pacote' de 'status/rework_round avancou sem tocar a secao Spec' -- risco real de desorientacao que a propria proposta lista como algo a evitar. Isso exige migracao de schema antes do freeze, nao e um refinamento opcional.",
    "Q3 (Barreira contra autoridade indevida): o padrao contratual ja documentado em docs/WORK_MODEL.md linha 174 ('a autoridade soberana permanece nos documentos originais') mais sources[] com digest e o verify fail-closed em scripts/resume_generate.py (funcao verify_resume_manifest, linhas 323-388) e o desenho correto. Mas a barreira mecanica e incompleta: campos como open_items, next_action e resolved_context[].reason sao texto derivado sem digest proprio -- nada impede o agente de citar essa prosa como se fosse evidencia, em vez de citar apenas sources[].path + selector + digest efetivamente lido. prompts/orchestrator.md e prompts/orchestrator-playbook.md (ambos no escopo de edicao da Fase A) precisam fixar uma regra testavel do tipo 'nenhuma decisao pode citar resolved_context ou open_items como prova; a citacao valida e sempre o par path+selector+digest lido diretamente da fonte'. Sem essa regra explicita e sem um item de rubrica de Checker que a verifique, o Principio 1 permanece aspiracional.",
    "Q4 (Deteccao de stale/drift): scripts/context_lib.py ja implementa evaluate_freshness(), que retorna um estado discriminado em tres valores (current, digest_changed, selector_not_found). Entretanto scripts/resume_generate.py --verify (linhas 614-631) NAO usa essa funcao discriminada: chama verify_resume_manifest, que devolve apenas um booleano mais uma lista de strings de erro livre impressas em stderr. A spec da propria T032 (linha 88 do arquivo de tarefa) promete explicitamente um status estruturado stale_package_rejected; esse literal nao existe em nenhum lugar do codigo hoje (grep confirmou zero ocorrencias fora do proprio arquivo de especificacao). AC02/AC03, como redigidos, nao podem ser satisfeitos pela implementacao atual sem adicionar uma saida de verify estruturada e legivel por maquina (idealmente reaproveitando os tres estados de evaluate_freshness por fonte, mais um enum de nivel de pacote: verified / stale_package_rejected / source_missing).",
    "Q5 (Criterios negativos de sessao nova): busca textual em docs/WORK_MODEL.md, docs/EXECUTION_PROTOCOL.md e docs/CONTEXT_POLICY.md nao encontrou nenhuma frase normativa sobre quando a retomada curta e contraindicada -- e uma lacuna total, nao um refinamento. Candidatos concretos a fixar antes do freeze: (a) contexto acumulado abaixo do limiar de ~120 mil tokens ja existente em EXECUTION_PROTOCOL.md linha 23-24 (abaixo dele, o custo de bootstrap tende a dominar, conforme achado Q1); (b) active_batch != none em STATUS.md, onde reconstruir decisoes ja abertas de um lote em andamento a partir do disco custa mais do que continuar a sessao corrente; (c) phase: debate, fase que a propria matriz de docs/CONTEXT_POLICY.md ja trata com mais entregas inline/excerpt e menos on_demand, sinalizando que compressao agressiva de contexto ja e considerada inadequada ali; (d) unidades cujo content_paths e tao extenso que a leitura seletiva degeneraria em leitura quase total (ver Q7).",
    "Q6 (Reconstrucao obrigatoria a partir das fontes): a tabela 'Versao do trabalho' de docs/WORK_MODEL.md (linhas 347-358) ja distingue content_id de 'Registros de controle' (status, state_revision, blocked_by, rework_round, cabecalho de coordenacao, tabela de STATUS.md, registro de revisao), que devem ser sempre lidos frescos. O ponto fraco concreto encontrado: a funcao derive_next_action (scripts/resume_generate.py linha 559) grava next_action como texto derivado de um snapshot de task_fm.get('status') no momento da geracao, sem digest algum vinculando esse texto ao frontmatter vivo da task. Se status mudar entre geracao e consumo do pacote, next_action fica silenciosamente obsoleto e nada em verify_resume_manifest detecta isso, porque o frontmatter da propria task nunca entra em sources[] (so entram as secoes ## Spec e ## Review). Esse e o mesmo gap raiz de Q2/Q4 e deve ser corrigido pela mesma extensao de schema/fontes.",
    "Q7 (Prevencao de inchaso de bootstrap): docs/CONTEXT_POLICY.md SS6 (Confinamento e isolamento) define ONDE a leitura pode acontecer (inputs/allowed-support), com violacoes registradas em reads_outside_allowed_set via scripts/context_ledger.py -- mas essa e uma barreira detectiva (flagra a leitura depois de feita), nao preventiva quanto a QUANTAS das fontes permitidas sao lidas em bloco logo no inicio. Nenhum documento revisado impoe um teto ao numero de leituras on_demand que uma sessao recem-aberta pode disparar antes da primeira acao material -- um agente 'cauteloso' pode legitimamente varrer todo o resolved_context sequencialmente, reproduzindo exatamente o inchaco volumoso que o protocolo existe para evitar, sem gerar nenhuma violacao registravel. T023 ja validou operacionalmente um padrao de orcamento duro (BudgetTracker / ArmTurnController, scripts do piloto) que poderia ser adaptado como teto de leituras de bootstrap por sessao.",
    "Q8 (Regra de ativacao): ja existe hoje um limiar objetivo e mensuravel em vigor -- docs/EXECUTION_PROTOCOL.md linha 23-24: 'acima de aproximadamente 120 mil tokens de contexto, grave um handoff curto em arquivo e recomende sessao nova'. Note-se que e uma recomendacao, nao um gatilho automatico. T032 nao deveria introduzir um segundo limiar paralelo e desincronizado; deve formalmente (a) promover esse limiar recomendado ja existente a regra canonica de ativacao do novo primitive, mantendo-o como recomendacao (nunca forcado, dado o achado Q5 sobre lotes em andamento), ou (b) emendar explicitamente essa linha se um limiar diferente for pretendido. Dado o achado Q1 (retomada curta pode custar mais tokens brutos que continuar), automatizar o gatilho sem condicionantes ainda nao e sustentado pela evidencia disponivel.",
    "Q9 (Persistencia duravel vs conversa efemera): docs/WORK_MODEL.md ja define com precisao as superficies duraveis para o metodo native -- frontmatter da Task (status/state_revision/rework_round/blocked_by), cabecalho de coordenacao e tabela de Tasks de STATUS.md (ambos reconstruiveis, nunca fonte bruta em si), e os registros de '## Review' -- exatamente o que scripts/resume_generate.py ja usa como sources. Essa parte do desenho e solida e so precisa da extensao ja apontada em Q2/Q4/Q6. A lacuna real encontrada: nenhum artefato revisado (WORK_MODEL.md, o arquivo de tarefa T032, ou resume_generate.py) especifica a politica de persistencia do proprio resume.json gerado -- se e stdout efemero consumido uma vez, ou um artefato versionado sob evidence/ ou diretorio de scratch. O Principio 10 (continuidade cross-harness) exige implicitamente alguma convencao de localizacao/transporte para que outro harness localize o pacote de um Ciclo N+1; a opcao mais segura e tratar resume.json como sempre regenerado sob demanda a partir das fontes (nunca persistido como estado proprio), o que tambem reaproveita naturalmente o mecanismo de verificacao ja existente."
  ],
  "alternatives": [
    "Antes de congelar AC02, executar uma migracao aditiva e retrocompativel de schemas/resume-manifest.schema.json adicionando state_revision, content_id, generated_at e generator_version -- sem isso, a propria Estrutura do Pacote (itens 1 e 6) da spec de T032 e inconsistente com o schema que ela declara herdar de T022.",
    "Estender scripts/resume_generate.py --verify para emitir um resultado JSON estruturado (nao apenas texto em stderr), reaproveitando os tres estados de context_lib.evaluate_freshness por fonte e expondo o literal stale_package_rejected exigido pela propria spec da tarefa.",
    "Adicionar o frontmatter da propria task ativa como uma entrada em sources[] (hoje so ## Spec e ## Review entram), fechando o gap de deteccao de drift de state_revision/status/rework_round identificado em Q4/Q6.",